{
  "$schema": "./studio.schema.json",
  "studioVersion": "0.1.1",
  "slug": "payment-icons",
  "designReference": {
    "fileKey": "k3axoTaF87g17fBRgJ0PMY",
    "frameNodeId": "943:7",
    "inspectorNodeId": "1020:480"
  },
  "groups": [
    {
      "id": "content",
      "label": "Content",
      "controls": [
        {
          "id": "icons",
          "label": "Payment marks",
          "kind": "slot-composition",
          "properties": [
            "icons"
          ]
        },
        {
          "id": "accessible-label",
          "label": "Accessible list label",
          "kind": "text",
          "properties": [
            "accessibleLabel"
          ]
        }
      ]
    },
    {
      "id": "presentation",
      "label": "Presentation",
      "controls": [
        {
          "id": "size",
          "label": "Size",
          "kind": "segmented",
          "properties": [
            "size"
          ],
          "optionLabels": {
            "default": "Default",
            "sm": "Small"
          }
        }
      ]
    },
    {
      "id": "appearance",
      "label": "Appearance",
      "controls": [
        {
          "id": "spacing",
          "label": "Collection spacing",
          "kind": "token",
          "tokens": {
            "category": "spacing",
            "names": [
              "--space-layout-element-gap"
            ]
          }
        }
      ]
    },
    {
      "id": "visual-values",
      "label": "Visual values",
      "controls": [
        {
          "id": "scale-payment-icons-gap",
          "label": "Payment mark gap",
          "kind": "token",
          "tokens": {
            "category": "spacing",
            "names": [
              "--scale-payment-icons-gap"
            ]
          }
        },
        {
          "id": "size-payment-icons-mark-height",
          "label": "Mark height",
          "kind": "token",
          "tokens": {
            "category": "spacing",
            "names": [
              "--size-payment-icons-mark-height"
            ]
          }
        },
        {
          "id": "size-payment-icons-small-mark-height",
          "label": "Small mark height",
          "kind": "token",
          "tokens": {
            "category": "spacing",
            "names": [
              "--size-payment-icons-small-mark-height"
            ]
          }
        }
      ]
    }
  ]
}
