{
  "$schema": "./studio.schema.json",
  "studioVersion": "0.3.0",
  "slug": "breadcrumb",
  "designReference": {
    "fileKey": "k3axoTaF87g17fBRgJ0PMY",
    "frameNodeId": "943:7",
    "inspectorNodeId": "1020:480"
  },
  "groups": [
    {
      "id": "content",
      "label": "Content",
      "controls": [
        {
          "id": "label",
          "label": "Navigation label",
          "kind": "text",
          "properties": [
            "label"
          ]
        },
        {
          "id": "current-label",
          "label": "Current page",
          "kind": "text",
          "properties": [
            "currentLabel"
          ]
        }
      ]
    },
    {
      "id": "appearance",
      "label": "Appearance",
      "controls": [
        {
          "id": "text",
          "label": "Links",
          "kind": "token-swatch",
          "tokens": {
            "category": "color",
            "names": [
              "--color-text-secondary"
            ]
          }
        },
        {
          "id": "hover",
          "label": "Hover accent",
          "kind": "token-swatch",
          "tokens": {
            "category": "color",
            "names": [
              "--color-text-accent"
            ]
          }
        },
        {
          "id": "separator",
          "label": "Separators",
          "kind": "token-swatch",
          "tokens": {
            "category": "color",
            "names": [
              "--color-text-disabled"
            ]
          }
        },
        {
          "id": "current",
          "label": "Current page / hover text",
          "kind": "token-swatch",
          "tokens": {
            "category": "color",
            "names": [
              "--color-text-primary"
            ]
          }
        },
        {
          "id": "focus",
          "label": "Focus",
          "kind": "token-swatch",
          "tokens": {
            "category": "color",
            "names": [
              "--color-border-focus"
            ]
          }
        },
        {
          "id": "spacing",
          "label": "Spacing base",
          "kind": "token",
          "tokens": {
            "category": "spacing",
            "names": [
              "--space-layout-element-gap"
            ]
          }
        },
        {
          "id": "target",
          "label": "Link target",
          "kind": "token",
          "tokens": {
            "category": "spacing",
            "names": [
              "--space-layout-touch-target"
            ]
          }
        },
        {
          "id": "type",
          "label": "Type",
          "kind": "token-pair",
          "tokens": {
            "category": "typography",
            "names": [
              "--typo-body-sm-size",
              "--typo-body-sm-line-height"
            ]
          }
        },
        {
          "id": "family",
          "label": "Typeface",
          "kind": "token",
          "tokens": {
            "category": "typography",
            "names": [
              "--font-family-body"
            ]
          }
        },
        {
          "id": "easing",
          "label": "Easing",
          "kind": "token",
          "tokens": {
            "category": "easing",
            "names": [
              "--easing-default"
            ]
          }
        },
        {
          "id": "transition",
          "label": "Transition",
          "kind": "token",
          "tokens": {
            "category": "transition",
            "names": [
              "--transition-fast"
            ]
          }
        }
      ]
    },
    {
      "id": "geometry",
      "label": "Geometry",
      "controls": [
        {
          "id": "geometry-gap",
          "label": "Segment gap factor",
          "kind": "token",
          "tokens": {
            "category": "spacing",
            "names": [
              "--ratio-breadcrumb-gap"
            ]
          }
        },
        {
          "id": "geometry-row-gap",
          "label": "Wrapped row gap factor",
          "kind": "token",
          "tokens": {
            "category": "spacing",
            "names": [
              "--ratio-breadcrumb-row-gap"
            ]
          }
        },
        {
          "id": "geometry-padding-block",
          "label": "Block padding factor",
          "kind": "token",
          "tokens": {
            "category": "spacing",
            "names": [
              "--ratio-breadcrumb-padding-block"
            ]
          }
        },
        {
          "id": "geometry-underline-offset",
          "label": "Underline offset",
          "kind": "token",
          "tokens": {
            "category": "spacing",
            "names": [
              "--space-breadcrumb-underline-offset"
            ]
          }
        },
        {
          "id": "geometry-focus-width",
          "label": "Focus width",
          "kind": "token",
          "tokens": {
            "category": "border",
            "names": [
              "--border-breadcrumb-focus-width"
            ]
          }
        },
        {
          "id": "geometry-focus-offset",
          "label": "Focus offset",
          "kind": "token",
          "tokens": {
            "category": "spacing",
            "names": [
              "--space-breadcrumb-focus-offset"
            ]
          }
        },
        {
          "id": "weight",
          "label": "Current page weight",
          "kind": "token",
          "tokens": {
            "category": "typography",
            "names": [
              "--tg-font-weight-medium"
            ]
          }
        }
      ]
    }
  ]
}
