{
  "$schema": "./studio.schema.json", "studioVersion": "0.1.0", "slug": "color-picker",
  "designReference": { "fileKey": "k3axoTaF87g17fBRgJ0PMY", "frameNodeId": "943:7", "inspectorNodeId": "1020:480" },
  "groups": [
    { "id": "presentation", "label": "Presentation", "controls": [
      { "id": "group-label", "label": "Group label", "kind": "text", "properties": ["groupLabel"] },
      { "id": "label", "label": "First color name", "kind": "text", "properties": ["label"] },
      { "id": "value", "label": "First color value", "kind": "text", "properties": ["value"] },
      { "id": "name", "label": "Group name", "kind": "text", "properties": ["name"] },
      { "id": "variant", "label": "Validation", "kind": "segmented", "properties": ["variant"] },
      { "id": "size", "label": "Size", "kind": "segmented", "properties": ["size"] },
      { "id": "checked", "label": "First color selected", "kind": "toggle", "properties": ["checked"] },
      { "id": "required", "label": "Required", "kind": "toggle", "properties": ["required"] },
      { "id": "disabled", "label": "Disabled", "kind": "toggle", "properties": ["disabled"] },
      { "id": "described-by", "label": "Description id", "kind": "text", "properties": ["describedBy"] }
    ] },
    { "id": "appearance", "label": "Appearance", "controls": [
        {"id": "required-marker", "label": "Required marker", "kind": "token-swatch", "tokens": {"category": "color", "names": ["--color-field-required"]}},
      { "id": "default-border", "label": "Default border", "kind": "token-swatch", "tokens": { "category": "color", "names": ["--color-border-subtle"] } },
      { "id": "error-border", "label": "Error", "kind": "token-swatch", "tokens": { "category": "color", "names": ["--color-input-error-unfocused-inner-border"] } },
      { "id": "success-border", "label": "Success", "kind": "token-swatch", "tokens": { "category": "color", "names": ["--color-input-success-unfocused-inner-border"] } },
      { "id": "warning-border", "label": "Warning", "kind": "token-swatch", "tokens": { "category": "color", "names": ["--color-input-warning-unfocused-inner-border"] } },
      { "id": "radius", "label": "Radius", "kind": "token", "tokens": { "category": "radius", "names": ["--radius-full"] } }
    ] }
  ]
}
