{
  "$schema": "./studio.schema.json",
  "studioVersion": "0.1.1",
  "slug": "multicolumn",
  "designReference": {
    "fileKey": "k3axoTaF87g17fBRgJ0PMY",
    "frameNodeId": "943:7",
    "inspectorNodeId": "1020:480"
  },
  "groups": [
    {
      "id": "content",
      "label": "Content",
      "controls": [
        {
          "id": "title",
          "label": "Title",
          "kind": "text",
          "properties": [
            "title"
          ]
        }
      ]
    },
    {
      "id": "composition",
      "label": "Composition",
      "controls": [
        {
          "id": "items",
          "label": "Columns",
          "kind": "slot-composition",
          "properties": [
            "items"
          ]
        }
      ]
    },
    {
      "id": "appearance",
      "label": "Appearance",
      "controls": [
        {
          "id": "text-color-text-primary",
          "label": "Primary text",
          "kind": "token-swatch",
          "tokens": {
            "category": "color",
            "names": [
              "--color-text-primary"
            ]
          }
        },
        {
          "id": "text-color-text-secondary",
          "label": "Secondary text",
          "kind": "token-swatch",
          "tokens": {
            "category": "color",
            "names": [
              "--color-text-secondary"
            ]
          }
        },
        {
          "id": "text-color-text-accent",
          "label": "Accent text",
          "kind": "token-swatch",
          "tokens": {
            "category": "color",
            "names": [
              "--color-text-accent"
            ]
          }
        },
        {
          "id": "grid-gap",
          "label": "Grid gap",
          "kind": "token",
          "tokens": {
            "category": "spacing",
            "names": [
              "--space-layout-grid-gap"
            ]
          }
        },
        {
          "id": "heading-type",
          "label": "Heading type",
          "kind": "token-pair",
          "tokens": {
            "category": "typography",
            "names": [
              "--typo-h2-size",
              "--typo-h4-size"
            ]
          }
        }
      ]
    }
  ]
}
