{
  "$schema": "./studio.schema.json",
  "studioVersion": "0.3.1",
  "slug": "artist-card",
  "designReference": {
    "fileKey": "k3axoTaF87g17fBRgJ0PMY",
    "frameNodeId": "943:7",
    "inspectorNodeId": "1020:480"
  },
  "groups": [
    {
      "id": "identity",
      "label": "Identity",
      "controls": [
        {
          "id": "portrait",
          "label": "Portrait",
          "kind": "slot-composition",
          "properties": [
            "portrait"
          ]
        },
        {
          "id": "badge",
          "label": "Badge label",
          "kind": "text",
          "properties": [
            "badge"
          ],
          "visibleWhen": {
            "property": "portrait",
            "equals": true
          }
        },
        {
          "id": "name",
          "label": "Name",
          "kind": "text",
          "properties": [
            "name"
          ]
        },
        {
          "id": "medium",
          "label": "Medium",
          "kind": "text",
          "properties": [
            "medium"
          ]
        },
        {
          "id": "location",
          "label": "Location",
          "kind": "text",
          "properties": [
            "location"
          ]
        },
        {
          "id": "piece-count",
          "label": "Piece count",
          "kind": "text",
          "properties": [
            "pieceCount"
          ]
        }
      ]
    },
    {
      "id": "appearance",
      "label": "Appearance",
      "controls": [
        {
          "id": "text-color-text-primary",
          "label": "Primary text",
          "kind": "token-swatch",
          "tokens": {
            "category": "color",
            "names": [
              "--color-text-primary"
            ]
          }
        },
        {
          "id": "text-color-text-secondary",
          "label": "Secondary text",
          "kind": "token-swatch",
          "tokens": {
            "category": "color",
            "names": [
              "--color-text-secondary"
            ]
          }
        },
        {
          "id": "focus",
          "label": "Focus",
          "kind": "token-swatch",
          "tokens": {
            "category": "color",
            "names": [
              "--color-border-focus"
            ]
          }
        },
        {
          "id": "media-radius",
          "label": "Media radius",
          "kind": "token",
          "tokens": {
            "category": "radius",
            "names": [
              "--radius-md"
            ]
          }
        },
        {
          "id": "media-motion",
          "label": "Media motion",
          "kind": "token",
          "tokens": {
            "category": "transition",
            "names": [
              "--motion-transition-media"
            ]
          }
        }
      ]
    },
    {
      "id": "visual-values",
      "label": "Component visual values",
      "controls": [
        {
          "id": "ratio-artist-card-portrait",
          "label": "Portrait width / height",
          "kind": "token",
          "tokens": {
            "category": "spacing",
            "names": [
              "--ratio-artist-card-portrait"
            ]
          }
        },
        {
          "id": "ratio-artist-card-media-gap",
          "label": "Portrait gap factor",
          "kind": "token",
          "tokens": {
            "category": "spacing",
            "names": [
              "--ratio-artist-card-media-gap"
            ]
          }
        },
        {
          "id": "ratio-artist-card-badge-block-inset",
          "label": "Badge block inset factor",
          "kind": "token",
          "tokens": {
            "category": "spacing",
            "names": [
              "--ratio-artist-card-badge-block-inset"
            ]
          }
        },
        {
          "id": "ratio-artist-card-badge-inline-inset",
          "label": "Badge inline inset factor",
          "kind": "token",
          "tokens": {
            "category": "spacing",
            "names": [
              "--ratio-artist-card-badge-inline-inset"
            ]
          }
        },
        {
          "id": "ratio-artist-card-name-gap",
          "label": "Name gap factor",
          "kind": "token",
          "tokens": {
            "category": "spacing",
            "names": [
              "--ratio-artist-card-name-gap"
            ]
          }
        },
        {
          "id": "ratio-artist-card-medium-gap",
          "label": "Medium gap factor",
          "kind": "token",
          "tokens": {
            "category": "spacing",
            "names": [
              "--ratio-artist-card-medium-gap"
            ]
          }
        },
        {
          "id": "ratio-artist-card-count-gap",
          "label": "Piece count gap factor",
          "kind": "token",
          "tokens": {
            "category": "spacing",
            "names": [
              "--ratio-artist-card-count-gap"
            ]
          }
        },
        {
          "id": "border-artist-card-focus-width",
          "label": "Focus width",
          "kind": "token",
          "tokens": {
            "category": "spacing",
            "names": [
              "--border-artist-card-focus-width"
            ]
          }
        },
        {
          "id": "space-artist-card-focus-offset",
          "label": "Focus offset",
          "kind": "token",
          "tokens": {
            "category": "spacing",
            "names": [
              "--space-artist-card-focus-offset"
            ]
          }
        },
        {
          "id": "scale-artist-card-hover",
          "label": "Interactive portrait scale",
          "kind": "token",
          "tokens": {
            "category": "transform",
            "names": [
              "--scale-artist-card-hover"
            ]
          }
        }
      ]
    },
    {
      "id": "system-values",
      "label": "System values",
      "controls": [
        {
          "id": "value-font-family-body",
          "label": "Body family",
          "kind": "token",
          "tokens": {
            "category": "typography",
            "names": [
              "--font-family-body"
            ]
          }
        },
        {
          "id": "value-font-family-heading",
          "label": "Heading family",
          "kind": "token",
          "tokens": {
            "category": "typography",
            "names": [
              "--font-family-heading"
            ]
          }
        },
        {
          "id": "value-tg-font-weight-medium",
          "label": "Name weight",
          "kind": "token",
          "tokens": {
            "category": "typography",
            "names": [
              "--tg-font-weight-medium"
            ]
          }
        },
        {
          "id": "value-tg-typography-body-caption-weight",
          "label": "Caption weight",
          "kind": "token",
          "tokens": {
            "category": "typography",
            "names": [
              "--tg-typography-body-caption-weight"
            ]
          }
        },
        {
          "id": "value-tg-typography-body-small-weight",
          "label": "Medium weight",
          "kind": "token",
          "tokens": {
            "category": "typography",
            "names": [
              "--tg-typography-body-small-weight"
            ]
          }
        },
        {
          "id": "value-typo-body-sm-line-height",
          "label": "Medium line height",
          "kind": "token",
          "tokens": {
            "category": "typography",
            "names": [
              "--typo-body-sm-line-height"
            ]
          }
        },
        {
          "id": "value-typo-body-sm-size",
          "label": "Medium size",
          "kind": "token",
          "tokens": {
            "category": "typography",
            "names": [
              "--typo-body-sm-size"
            ]
          }
        },
        {
          "id": "value-typo-caption-line-height",
          "label": "Caption line height",
          "kind": "token",
          "tokens": {
            "category": "typography",
            "names": [
              "--typo-caption-line-height"
            ]
          }
        },
        {
          "id": "value-typo-caption-size",
          "label": "Caption size",
          "kind": "token",
          "tokens": {
            "category": "typography",
            "names": [
              "--typo-caption-size"
            ]
          }
        },
        {
          "id": "value-typo-h4-line-height",
          "label": "Name line height",
          "kind": "token",
          "tokens": {
            "category": "typography",
            "names": [
              "--typo-h4-line-height"
            ]
          }
        },
        {
          "id": "value-typo-h4-size",
          "label": "Name size",
          "kind": "token",
          "tokens": {
            "category": "typography",
            "names": [
              "--typo-h4-size"
            ]
          }
        },
        {
          "id": "value-space-layout-element-gap",
          "label": "Element gap",
          "kind": "token",
          "tokens": {
            "category": "spacing",
            "names": [
              "--space-layout-element-gap"
            ]
          }
        }
      ]
    }
  ]
}
