{
  "$schema": "./studio.schema.json",
  "studioVersion": "0.2.0",
  "slug": "popup",
  "designReference": { "fileKey": "k3axoTaF87g17fBRgJ0PMY", "frameNodeId": "943:7", "inspectorNodeId": "1020:480" },
  "groups": [
    {
      "id": "behavior",
      "label": "Behavior",
      "controls": [
        { "id": "open", "label": "Open", "kind": "toggle", "properties": ["open"] }
      ]
    },
    {
      "id": "appearance",
      "label": "Appearance",
      "controls": [
        { "id": "surface", "label": "Surface", "kind": "token-swatch", "tokens": { "category": "color", "names": ["--color-surface-primary"] } },
        { "id": "border", "label": "Border", "kind": "token-swatch", "tokens": { "category": "color", "names": ["--color-border-subtle"] } },
        { "id": "text", "label": "Title", "kind": "token-swatch", "tokens": { "category": "color", "names": ["--color-text-primary"] } },
        { "id": "secondary", "label": "Content", "kind": "token-swatch", "tokens": { "category": "color", "names": ["--color-text-secondary"] } },
        { "id": "radius", "label": "Radius", "kind": "token", "tokens": { "category": "radius", "names": ["--radius-md"] } },
        { "id": "shadow", "label": "Shadow", "kind": "token", "tokens": { "category": "shadow", "names": ["--shadow-lg"] } },
        { "id": "body-size", "label": "Title type", "kind": "token", "tokens": { "category": "typography", "names": ["--typo-body-size"] } },
        { "id": "body-small", "label": "Content type", "kind": "token", "tokens": { "category": "typography", "names": ["--typo-body-sm-size"] } },
        { "id": "spacing", "label": "Spacing", "kind": "token", "tokens": { "category": "spacing", "names": ["--space-layout-element-gap"] } },
        { "id": "transition", "label": "Transition", "kind": "token", "tokens": { "category": "transition", "names": ["--transition-fast"] } }
      ]
    }
  ]
}
