{
  "$schema": "./studio.schema.json",
  "studioVersion": "0.1.1",
  "slug": "shipping-info",
  "designReference": {
    "fileKey": "k3axoTaF87g17fBRgJ0PMY",
    "frameNodeId": "943:7",
    "inspectorNodeId": "1020:480"
  },
  "groups": [
    {
      "id": "composition",
      "label": "Composition",
      "controls": [
        {
          "id": "items",
          "label": "Shipping items",
          "kind": "slot-composition",
          "properties": [
            "items"
          ]
        }
      ]
    },
    {
      "id": "appearance",
      "label": "Appearance",
      "controls": [
        {
          "id": "text-color-text-primary",
          "label": "Primary text",
          "kind": "token-swatch",
          "tokens": {
            "category": "color",
            "names": [
              "--color-text-primary"
            ]
          }
        },
        {
          "id": "text-color-text-secondary",
          "label": "Secondary text",
          "kind": "token-swatch",
          "tokens": {
            "category": "color",
            "names": [
              "--color-text-secondary"
            ]
          }
        },
        {
          "id": "label-size",
          "label": "Label size",
          "kind": "token",
          "tokens": {
            "category": "typography",
            "names": [
              "--typo-body-size"
            ]
          }
        },
        {
          "id": "supporting-size",
          "label": "Supporting size",
          "kind": "token",
          "tokens": {
            "category": "typography",
            "names": [
              "--typo-body-sm-size"
            ]
          }
        },
        {
          "id": "section-space",
          "label": "Section rhythm",
          "kind": "token",
          "tokens": {
            "category": "spacing",
            "names": [
              "--space-layout-section-gap"
            ]
          }
        }
      ]
    }
  ]
}
