{
  "$schema": "./studio.schema.json",
  "studioVersion": "0.2.1",
  "slug": "ceramics-glossary",
  "designReference": {
    "fileKey": "k3axoTaF87g17fBRgJ0PMY",
    "frameNodeId": "943:7",
    "inspectorNodeId": "1020:480"
  },
  "groups": [
    {
      "id": "content",
      "label": "Content",
      "controls": [
        {
          "id": "title",
          "label": "Title",
          "kind": "text",
          "properties": [
            "title"
          ]
        },
        {
          "id": "intro",
          "label": "Introduction",
          "kind": "text",
          "properties": [
            "intro"
          ]
        }
      ]
    },
    {
      "id": "composition",
      "label": "Composition",
      "controls": [
        {
          "id": "terms",
          "label": "Glossary terms",
          "kind": "slot-composition",
          "properties": [
            "terms"
          ]
        }
      ]
    },
    {
      "id": "appearance",
      "label": "Appearance",
      "controls": [
        {
          "id": "statement",
          "label": "Letter rule",
          "kind": "token-swatch",
          "tokens": {
            "category": "color",
            "names": [
              "--color-surface-statement"
            ]
          }
        },
        {
          "id": "shared-color-text-primary",
          "label": "Primary text",
          "kind": "token-swatch",
          "tokens": {
            "category": "color",
            "names": [
              "--color-text-primary"
            ]
          }
        },
        {
          "id": "shared-color-text-secondary",
          "label": "Secondary text",
          "kind": "token-swatch",
          "tokens": {
            "category": "color",
            "names": [
              "--color-text-secondary"
            ]
          }
        },
        {
          "id": "shared-font-family-heading",
          "label": "Heading font",
          "kind": "token",
          "tokens": {
            "category": "typography",
            "names": [
              "--font-family-heading"
            ]
          }
        },
        {
          "id": "shared-typo-h2-size",
          "label": "Title size",
          "kind": "token",
          "tokens": {
            "category": "typography",
            "names": [
              "--typo-h2-size"
            ]
          }
        },
        {
          "id": "shared-typo-h3-size",
          "label": "Letter heading size",
          "kind": "token",
          "tokens": {
            "category": "typography",
            "names": [
              "--typo-h3-size"
            ]
          }
        },
        {
          "id": "shared-typo-body-size",
          "label": "Body text size",
          "kind": "token",
          "tokens": {
            "category": "typography",
            "names": [
              "--typo-body-size"
            ]
          }
        },
        {
          "id": "shared-typo-body-sm-size",
          "label": "Small text size",
          "kind": "token",
          "tokens": {
            "category": "typography",
            "names": [
              "--typo-body-sm-size"
            ]
          }
        },
        {
          "id": "shared-typo-body-line-height",
          "label": "Body line height",
          "kind": "token",
          "tokens": {
            "category": "typography",
            "names": [
              "--typo-body-line-height"
            ]
          }
        },
        {
          "id": "shared-layout-gutter",
          "label": "Content horizontal inset",
          "kind": "token",
          "tokens": {
            "category": "spacing",
            "names": [
              "--layout-gutter"
            ]
          }
        },
        {
          "id": "shared-space-layout-element-gap",
          "label": "Element gap",
          "kind": "token",
          "tokens": {
            "category": "spacing",
            "names": [
              "--space-layout-element-gap"
            ]
          }
        },
        {
          "id": "shared-space-layout-section-gap",
          "label": "Section gap",
          "kind": "token",
          "tokens": {
            "category": "spacing",
            "names": [
              "--space-layout-section-gap"
            ]
          }
        },
        {
          "id": "radius",
          "label": "Radius",
          "kind": "token",
          "tokens": {
            "category": "radius",
            "names": [
              "--radius-sm"
            ]
          }
        },
        {
          "id": "tg-typography-h2-weight",
          "label": "Title weight",
          "kind": "token",
          "tokens": {
            "category": "typography",
            "names": [
              "--tg-typography-h2-weight"
            ]
          }
        },
        {
          "id": "typo-h2-line-height",
          "label": "Title line height",
          "kind": "token",
          "tokens": {
            "category": "typography",
            "names": [
              "--typo-h2-line-height"
            ]
          }
        },
        {
          "id": "tg-typography-h3-weight",
          "label": "Letter heading weight",
          "kind": "token",
          "tokens": {
            "category": "typography",
            "names": [
              "--tg-typography-h3-weight"
            ]
          }
        },
        {
          "id": "typo-h3-line-height",
          "label": "Letter heading line height",
          "kind": "token",
          "tokens": {
            "category": "typography",
            "names": [
              "--typo-h3-line-height"
            ]
          }
        }
      ]
    },
    {
      "id": "visual-values",
      "label": "Visual values",
      "controls": [
        {
          "id": "max-width",
          "label": "Glossary maximum width",
          "kind": "token",
          "tokens": {
            "category": "spacing",
            "names": [
              "--space-glossary-max-width"
            ]
          }
        },
        {
          "id": "media-max-width",
          "label": "Definition image maximum width",
          "kind": "token",
          "tokens": {
            "category": "spacing",
            "names": [
              "--space-glossary-media-max-width"
            ]
          }
        },
        {
          "id": "block-padding-scale",
          "label": "Vertical padding factor",
          "kind": "token",
          "tokens": {
            "category": "spacing",
            "names": [
              "--ratio-glossary-block-padding"
            ]
          }
        },
        {
          "id": "inline-padding-scale",
          "label": "Horizontal padding factor",
          "kind": "token",
          "tokens": {
            "category": "spacing",
            "names": [
              "--ratio-glossary-inline-padding"
            ]
          }
        },
        {
          "id": "intro-gap-scale",
          "label": "Introduction gap factor",
          "kind": "token",
          "tokens": {
            "category": "spacing",
            "names": [
              "--ratio-glossary-intro-gap"
            ]
          }
        },
        {
          "id": "group-gap-scale",
          "label": "Letter group gap factor",
          "kind": "token",
          "tokens": {
            "category": "spacing",
            "names": [
              "--ratio-glossary-group-gap"
            ]
          }
        },
        {
          "id": "letter-gap-scale",
          "label": "Letter to terms gap factor",
          "kind": "token",
          "tokens": {
            "category": "spacing",
            "names": [
              "--ratio-glossary-letter-gap"
            ]
          }
        },
        {
          "id": "letter-padding-scale",
          "label": "Letter rule padding factor",
          "kind": "token",
          "tokens": {
            "category": "spacing",
            "names": [
              "--ratio-glossary-letter-padding"
            ]
          }
        },
        {
          "id": "letter-border-width",
          "label": "Letter rule thickness",
          "kind": "token",
          "tokens": {
            "category": "border",
            "names": [
              "--border-glossary-letter-width"
            ]
          }
        },
        {
          "id": "scroll-offset-scale",
          "label": "Letter scroll offset factor",
          "kind": "token",
          "tokens": {
            "category": "spacing",
            "names": [
              "--ratio-glossary-scroll-offset"
            ]
          }
        },
        {
          "id": "image-gap-scale",
          "label": "Definition image gap factor",
          "kind": "token",
          "tokens": {
            "category": "spacing",
            "names": [
              "--ratio-glossary-image-gap"
            ]
          }
        },
        {
          "id": "related-gap-scale",
          "label": "Related terms gap factor",
          "kind": "token",
          "tokens": {
            "category": "spacing",
            "names": [
              "--ratio-glossary-related-gap"
            ]
          }
        }
      ]
    }
  ]
}
