{
  "$schema": "./studio.schema.json",
  "studioVersion": "0.2.0",
  "slug": "toggle",
  "designReference": {
    "fileKey": "k3axoTaF87g17fBRgJ0PMY",
    "frameNodeId": "943:7",
    "inspectorNodeId": "1020:480"
  },
  "groups": [
    {
      "id": "content",
      "label": "Content",
      "controls": [
        {
          "id": "group-label",
          "label": "Group label",
          "kind": "text",
          "properties": [
            "groupLabel"
          ]
        }
      ]
    },
    {
      "id": "presentation",
      "label": "Presentation",
      "controls": [
        {
          "id": "state",
          "label": "State",
          "kind": "state",
          "properties": [
            "disabled"
          ],
          "source": "states",
          "optionLabels": {
            "default": "Default",
            "hover": "Hover",
            "pressed": "Pressed",
            "focusVisible": "Focus",
            "disabled": "Disabled"
          }
        }
      ]
    },
    {
      "id": "appearance",
      "label": "Appearance",
      "controls": [
        {
          "id": "selected-surface",
          "label": "Selected surface",
          "kind": "token-swatch",
          "tokens": {
            "category": "color",
            "names": [
              "--color-button-primary-bg-default"
            ]
          }
        },
        {
          "id": "hover-surface",
          "label": "Hover surface",
          "kind": "token-swatch",
          "tokens": {
            "category": "color",
            "names": [
              "--color-surface-secondary"
            ]
          }
        },
        {
          "id": "default-text",
          "label": "Default text",
          "kind": "token-swatch",
          "tokens": {
            "category": "color",
            "names": [
              "--color-text-secondary"
            ]
          }
        },
        {
          "id": "selected-text",
          "label": "Selected text",
          "kind": "token-swatch",
          "tokens": {
            "category": "color",
            "names": [
              "--color-button-primary-text-default"
            ]
          }
        },
        {
          "id": "default-border",
          "label": "Default border",
          "kind": "token-swatch",
          "tokens": {
            "category": "color",
            "names": [
              "--color-border-subtle"
            ]
          }
        },
        {
          "id": "focus",
          "label": "Focus",
          "kind": "token-swatch",
          "tokens": {
            "category": "color",
            "names": [
              "--color-border-focus"
            ]
          }
        },
        {
          "id": "radius",
          "label": "Radius",
          "kind": "token",
          "tokens": {
            "category": "radius",
            "names": [
              "--radius-md"
            ]
          }
        },
        {
          "id": "type-size",
          "label": "Type size",
          "kind": "token",
          "tokens": {
            "category": "typography",
            "names": [
              "--typo-body-size"
            ]
          }
        },
        {
          "id": "type-family",
          "label": "Type family",
          "kind": "token",
          "tokens": {
            "category": "typography",
            "names": [
              "--font-family-body"
            ]
          }
        },
        {
          "id": "transition",
          "label": "Transition",
          "kind": "token",
          "tokens": {
            "category": "transition",
            "names": [
              "--transition-fast"
            ]
          }
        },
        {
          "id": "easing",
          "label": "Easing",
          "kind": "token",
          "tokens": {
            "category": "easing",
            "names": [
              "--easing-default"
            ]
          }
        },
        {
          "id": "disabled-opacity",
          "label": "Disabled opacity",
          "kind": "token",
          "tokens": {
            "category": "opacity",
            "names": [
              "--opacity-disabled"
            ]
          }
        },
        {
          "id": "visual-gap",
          "label": "Content gap",
          "kind": "token",
          "tokens": {
            "category": "spacing",
            "names": [
              "--space-toggle-gap"
            ]
          }
        },
        {
          "id": "visual-padding-x",
          "label": "Inline padding",
          "kind": "token",
          "tokens": {
            "category": "spacing",
            "names": [
              "--space-toggle-padding-x"
            ]
          }
        },
        {
          "id": "visual-padding-y",
          "label": "Block padding",
          "kind": "token",
          "tokens": {
            "category": "spacing",
            "names": [
              "--space-toggle-padding-y"
            ]
          }
        },
        {
          "id": "visual-min-height",
          "label": "Minimum height",
          "kind": "token",
          "tokens": {
            "category": "spacing",
            "names": [
              "--space-toggle-min-height"
            ]
          }
        },
        {
          "id": "visual-group-gap",
          "label": "Group gap",
          "kind": "token",
          "tokens": {
            "category": "spacing",
            "names": [
              "--space-toggle-group-gap"
            ]
          }
        },
        {
          "id": "visual-border-width",
          "label": "Border width",
          "kind": "token",
          "tokens": {
            "category": "border",
            "names": [
              "--border-toggle-border-width"
            ]
          }
        },
        {
          "id": "visual-focus-ring-width",
          "label": "Focus width",
          "kind": "token",
          "tokens": {
            "category": "border",
            "names": [
              "--border-toggle-focus-ring-width"
            ]
          }
        },
        {
          "id": "visual-focus-ring-offset",
          "label": "Focus offset",
          "kind": "token",
          "tokens": {
            "category": "border",
            "names": [
              "--border-toggle-focus-ring-offset"
            ]
          }
        },
        {
          "id": "visual-background",
          "label": "Default surface",
          "kind": "token-swatch",
          "tokens": {
            "category": "color",
            "names": [
              "--color-toggle-background"
            ]
          }
        }
      ]
    }
  ]
}
