{
  "$schema": "./studio.schema.json",
  "studioVersion": "0.1.1",
  "slug": "cart-summary",
  "designReference": {
    "fileKey": "k3axoTaF87g17fBRgJ0PMY",
    "frameNodeId": "943:7",
    "inspectorNodeId": "1020:480"
  },
  "groups": [
    {
      "id": "content",
      "label": "Content",
      "controls": [
        {
          "id": "title",
          "label": "Title",
          "kind": "text",
          "properties": [
            "title"
          ]
        },
        {
          "id": "note",
          "label": "Note",
          "kind": "text",
          "properties": [
            "note"
          ]
        },
        {
          "id": "checkout-label",
          "label": "Checkout label",
          "kind": "text",
          "properties": [
            "checkoutLabel"
          ]
        }
      ]
    },
    {
      "id": "commerce",
      "label": "Commerce",
      "controls": [
        {
          "id": "rows",
          "label": "Summary rows",
          "kind": "slot-composition",
          "properties": [
            "rows"
          ]
        },
        {
          "id": "express",
          "label": "Express checkout",
          "kind": "slot-composition",
          "properties": [
            "express"
          ]
        }
      ]
    },
    {
      "id": "behavior",
      "label": "Behavior",
      "controls": [
        {
          "id": "checkout-disabled",
          "label": "Checkout disabled",
          "kind": "toggle",
          "properties": [
            "checkoutDisabled"
          ]
        },
        {
          "id": "checkout-busy",
          "label": "Checkout busy",
          "kind": "toggle",
          "properties": [
            "checkoutBusy"
          ]
        }
      ]
    },
    {
      "id": "presentation",
      "label": "Presentation",
      "controls": [
        {
          "id": "surface",
          "label": "Surface",
          "kind": "token-swatch",
          "tokens": {
            "category": "color",
            "names": [
              "--color-surface-secondary"
            ]
          }
        },
        {
          "id": "divider",
          "label": "Divider",
          "kind": "token-swatch",
          "tokens": {
            "category": "color",
            "names": [
              "--color-border-subtle"
            ]
          }
        },
        {
          "id": "radius",
          "label": "Radius",
          "kind": "token",
          "tokens": {
            "category": "radius",
            "names": [
              "--radius-lg"
            ]
          }
        }
      ]
    },
    {
      "id": "visual-values",
      "label": "Visual values",
      "controls": [
        {
          "id": "color-text-primary",
          "label": "Primary text",
          "kind": "token-swatch",
          "tokens": {
            "category": "color",
            "names": [
              "--color-text-primary"
            ]
          }
        },
        {
          "id": "color-text-secondary",
          "label": "Secondary text",
          "kind": "token-swatch",
          "tokens": {
            "category": "color",
            "names": [
              "--color-text-secondary"
            ]
          }
        },
        {
          "id": "space-layout-element-gap",
          "label": "Element gap",
          "kind": "token",
          "tokens": {
            "category": "spacing",
            "names": [
              "--space-layout-element-gap"
            ]
          }
        },
        {
          "id": "ratio-cart-summary-gap",
          "label": "Summary gap factor",
          "kind": "token",
          "tokens": {
            "category": "spacing",
            "names": [
              "--ratio-cart-summary-gap"
            ]
          }
        },
        {
          "id": "ratio-cart-summary-padding",
          "label": "Summary padding factor",
          "kind": "token",
          "tokens": {
            "category": "spacing",
            "names": [
              "--ratio-cart-summary-padding"
            ]
          }
        },
        {
          "id": "ratio-cart-summary-rows-gap",
          "label": "Summary rows gap factor",
          "kind": "token",
          "tokens": {
            "category": "spacing",
            "names": [
              "--ratio-cart-summary-rows-gap"
            ]
          }
        },
        {
          "id": "ratio-cart-summary-row-gap",
          "label": "Row label to value gap factor",
          "kind": "token",
          "tokens": {
            "category": "spacing",
            "names": [
              "--ratio-cart-summary-row-gap"
            ]
          }
        },
        {
          "id": "ratio-cart-summary-total-margin",
          "label": "Total top gap factor",
          "kind": "token",
          "tokens": {
            "category": "spacing",
            "names": [
              "--ratio-cart-summary-total-margin"
            ]
          }
        },
        {
          "id": "ratio-cart-summary-total-padding",
          "label": "Total divider padding factor",
          "kind": "token",
          "tokens": {
            "category": "spacing",
            "names": [
              "--ratio-cart-summary-total-padding"
            ]
          }
        },
        {
          "id": "ratio-cart-summary-express-gap",
          "label": "Express content gap factor",
          "kind": "token",
          "tokens": {
            "category": "spacing",
            "names": [
              "--ratio-cart-summary-express-gap"
            ]
          }
        },
        {
          "id": "font-family-heading",
          "label": "Heading font",
          "kind": "token",
          "tokens": {
            "category": "typography",
            "names": [
              "--font-family-heading"
            ]
          }
        },
        {
          "id": "font-family-body",
          "label": "Body font",
          "kind": "token",
          "tokens": {
            "category": "typography",
            "names": [
              "--font-family-body"
            ]
          }
        },
        {
          "id": "typo-h4-size",
          "label": "Small heading size",
          "kind": "token",
          "tokens": {
            "category": "typography",
            "names": [
              "--typo-h4-size"
            ]
          }
        },
        {
          "id": "typo-h4-line-height",
          "label": "Small heading line height",
          "kind": "token",
          "tokens": {
            "category": "typography",
            "names": [
              "--typo-h4-line-height"
            ]
          }
        },
        {
          "id": "typo-body-size",
          "label": "Body size",
          "kind": "token",
          "tokens": {
            "category": "typography",
            "names": [
              "--typo-body-size"
            ]
          }
        },
        {
          "id": "typo-body-line-height",
          "label": "Body line height",
          "kind": "token",
          "tokens": {
            "category": "typography",
            "names": [
              "--typo-body-line-height"
            ]
          }
        },
        {
          "id": "typo-body-sm-size",
          "label": "Small text size",
          "kind": "token",
          "tokens": {
            "category": "typography",
            "names": [
              "--typo-body-sm-size"
            ]
          }
        },
        {
          "id": "typo-body-sm-line-height",
          "label": "Small text line height",
          "kind": "token",
          "tokens": {
            "category": "typography",
            "names": [
              "--typo-body-sm-line-height"
            ]
          }
        },
        {
          "id": "tg-typography-body-small-weight",
          "label": "Small text weight",
          "kind": "token",
          "tokens": {
            "category": "typography",
            "names": [
              "--tg-typography-body-small-weight"
            ]
          }
        },
        {
          "id": "tg-typography-body-default-weight",
          "label": "Body weight",
          "kind": "token",
          "tokens": {
            "category": "typography",
            "names": [
              "--tg-typography-body-default-weight"
            ]
          }
        },
        {
          "id": "typo-cart-summary-title-weight",
          "label": "Summary title weight",
          "kind": "token",
          "tokens": {
            "category": "typography",
            "names": [
              "--typo-cart-summary-title-weight"
            ]
          }
        },
        {
          "id": "typo-cart-summary-total-weight",
          "label": "Summary total weight",
          "kind": "token",
          "tokens": {
            "category": "typography",
            "names": [
              "--typo-cart-summary-total-weight"
            ]
          }
        },
        {
          "id": "border-cart-summary-total-width",
          "label": "Total divider thickness",
          "kind": "token",
          "tokens": {
            "category": "border",
            "names": [
              "--border-cart-summary-total-width"
            ]
          }
        }
      ]
    }
  ]
}
