{
  "$schema": "./studio.schema.json",
  "studioVersion": "0.2.1",
  "slug": "password-reset",
  "designReference": {
    "fileKey": "k3axoTaF87g17fBRgJ0PMY",
    "frameNodeId": "943:7",
    "inspectorNodeId": "1020:480"
  },
  "groups": [
    {
      "id": "content",
      "label": "Content",
      "controls": [
        {
          "id": "title",
          "label": "Title",
          "kind": "text",
          "properties": [
            "title"
          ]
        },
        {
          "id": "text",
          "label": "Guidance",
          "kind": "text",
          "properties": [
            "text"
          ]
        },
        {
          "id": "success-message",
          "label": "Confirmed feedback",
          "kind": "text",
          "properties": [
            "successMessage"
          ]
        }
      ]
    },
    {
      "id": "composition",
      "label": "Composition",
      "controls": [
        {
          "id": "icon",
          "label": "Icon",
          "kind": "slot-composition",
          "properties": [
            "icon"
          ]
        },
        {
          "id": "form",
          "label": "Form",
          "kind": "slot-composition",
          "properties": [
            "form"
          ]
        }
      ]
    },
    {
      "id": "presentation",
      "label": "Presentation",
      "controls": [
        {
          "id": "primary-text",
          "label": "Primary text",
          "kind": "token-swatch",
          "tokens": {
            "category": "color",
            "names": [
              "--color-text-primary"
            ]
          }
        },
        {
          "id": "supporting-text",
          "label": "Supporting text",
          "kind": "token-swatch",
          "tokens": {
            "category": "color",
            "names": [
              "--color-text-secondary"
            ]
          }
        },
        {
          "id": "illustration",
          "label": "Illustration",
          "kind": "token-swatch",
          "tokens": {
            "category": "color",
            "names": [
              "--color-text-disabled"
            ]
          }
        },
        {
          "id": "section-gap",
          "label": "Section gap",
          "kind": "token",
          "tokens": {
            "category": "spacing",
            "names": [
              "--space-layout-section-gap"
            ]
          }
        },
        {
          "id": "content-gap",
          "label": "Content gap",
          "kind": "token",
          "tokens": {
            "category": "spacing",
            "names": [
              "--tg-space-stack-lg"
            ]
          }
        }
      ]
    },
    {
      "id": "visual-values",
      "label": "Visual values",
      "controls": [
        {
          "id": "space-layout-container",
          "label": "Horizontal padding base",
          "kind": "token",
          "tokens": {
            "category": "spacing",
            "names": [
              "--space-layout-container"
            ]
          }
        },
        {
          "id": "tg-space-stack-md",
          "label": "Medium stack base",
          "kind": "token",
          "tokens": {
            "category": "spacing",
            "names": [
              "--tg-space-stack-md"
            ]
          }
        },
        {
          "id": "tg-space-stack-sm",
          "label": "Small stack base",
          "kind": "token",
          "tokens": {
            "category": "spacing",
            "names": [
              "--tg-space-stack-sm"
            ]
          }
        },
        {
          "id": "tg-space-stack-xs",
          "label": "Compact stack base",
          "kind": "token",
          "tokens": {
            "category": "spacing",
            "names": [
              "--tg-space-stack-xs"
            ]
          }
        },
        {
          "id": "size-password-reset-content-max",
          "label": "Useful form maximum",
          "kind": "token",
          "tokens": {
            "category": "spacing",
            "names": [
              "--size-password-reset-content-max"
            ]
          }
        },
        {
          "id": "ratio-password-reset-block-padding",
          "label": "Vertical padding factor",
          "kind": "token",
          "tokens": {
            "category": "spacing",
            "names": [
              "--ratio-password-reset-block-padding"
            ]
          }
        },
        {
          "id": "ratio-password-reset-inline-padding",
          "label": "Horizontal padding factor",
          "kind": "token",
          "tokens": {
            "category": "spacing",
            "names": [
              "--ratio-password-reset-inline-padding"
            ]
          }
        },
        {
          "id": "ratio-password-reset-icon-gap",
          "label": "Icon to header gap factor",
          "kind": "token",
          "tokens": {
            "category": "spacing",
            "names": [
              "--ratio-password-reset-icon-gap"
            ]
          }
        },
        {
          "id": "ratio-password-reset-header-gap",
          "label": "Header text gap factor",
          "kind": "token",
          "tokens": {
            "category": "spacing",
            "names": [
              "--ratio-password-reset-header-gap"
            ]
          }
        },
        {
          "id": "ratio-password-reset-section-gap",
          "label": "Header to form gap factor",
          "kind": "token",
          "tokens": {
            "category": "spacing",
            "names": [
              "--ratio-password-reset-section-gap"
            ]
          }
        },
        {
          "id": "ratio-password-reset-form-gap",
          "label": "Form gap factor",
          "kind": "token",
          "tokens": {
            "category": "spacing",
            "names": [
              "--ratio-password-reset-form-gap"
            ]
          }
        },
        {
          "id": "size-password-reset-icon",
          "label": "Decorative icon size",
          "kind": "token",
          "tokens": {
            "category": "spacing",
            "names": [
              "--size-password-reset-icon"
            ]
          }
        },
        {
          "id": "font-family-heading",
          "label": "Heading font",
          "kind": "token",
          "tokens": {
            "category": "typography",
            "names": [
              "--font-family-heading"
            ]
          }
        },
        {
          "id": "typo-h3-size",
          "label": "Title size",
          "kind": "token",
          "tokens": {
            "category": "typography",
            "names": [
              "--typo-h3-size"
            ]
          }
        },
        {
          "id": "typo-h3-line-height",
          "label": "Title line height",
          "kind": "token",
          "tokens": {
            "category": "typography",
            "names": [
              "--typo-h3-line-height"
            ]
          }
        },
        {
          "id": "typo-body-size",
          "label": "Body size",
          "kind": "token",
          "tokens": {
            "category": "typography",
            "names": [
              "--typo-body-size"
            ]
          }
        },
        {
          "id": "typo-body-line-height",
          "label": "Body line height",
          "kind": "token",
          "tokens": {
            "category": "typography",
            "names": [
              "--typo-body-line-height"
            ]
          }
        },
        {
          "id": "font-family-body",
          "label": "Body font",
          "kind": "token",
          "tokens": {
            "category": "typography",
            "names": [
              "--font-family-body"
            ]
          }
        },
        {
          "id": "typo-body-weight",
          "label": "Body weight",
          "kind": "token",
          "tokens": {
            "category": "typography",
            "names": [
              "--typo-body-weight"
            ]
          }
        },
        {
          "id": "typo-password-reset-title-weight",
          "label": "Title weight",
          "kind": "token",
          "tokens": {
            "category": "typography",
            "names": [
              "--typo-password-reset-title-weight"
            ]
          }
        }
      ]
    }
  ]
}
