{
  "$schema": "./studio.schema.json",
  "studioVersion": "0.1.1",
  "slug": "policy-page",
  "designReference": {
    "fileKey": "k3axoTaF87g17fBRgJ0PMY",
    "frameNodeId": "943:7",
    "inspectorNodeId": "1020:480"
  },
  "groups": [
    {
      "id": "content",
      "label": "Content",
      "controls": [
        {
          "id": "title",
          "label": "Title",
          "kind": "text",
          "properties": [
            "title"
          ]
        },
        {
          "id": "updated-date",
          "label": "Updated date",
          "kind": "text",
          "properties": [
            "updatedDate"
          ]
        },
        {
          "id": "updated-date-time",
          "label": "Machine date",
          "kind": "text",
          "properties": [
            "updatedDateTime"
          ]
        },
        {
          "id": "toc-title",
          "label": "Contents title",
          "kind": "text",
          "properties": [
            "tocTitle"
          ]
        }
      ]
    },
    {
      "id": "composition",
      "label": "Composition",
      "controls": [
        {
          "id": "toc-items",
          "label": "Contents links",
          "kind": "slot-composition",
          "properties": [
            "tocItems"
          ]
        },
        {
          "id": "body",
          "label": "Policy body",
          "kind": "slot-composition",
          "properties": [
            "body"
          ]
        }
      ]
    },
    {
      "id": "appearance",
      "label": "Appearance",
      "controls": [
        {
          "id": "text-colors-color-text-primary",
          "label": "Primary text",
          "kind": "token-swatch",
          "tokens": {
            "category": "color",
            "names": [
              "--color-text-primary"
            ]
          }
        },
        {
          "id": "text-colors-color-text-secondary",
          "label": "Secondary text",
          "kind": "token-swatch",
          "tokens": {
            "category": "color",
            "names": [
              "--color-text-secondary"
            ]
          }
        },
        {
          "id": "surface",
          "label": "Contents surface",
          "kind": "token-swatch",
          "tokens": {
            "category": "color",
            "names": [
              "--color-surface-secondary"
            ]
          }
        },
        {
          "id": "accent-color-text-accent",
          "label": "Accent text",
          "kind": "token-swatch",
          "tokens": {
            "category": "color",
            "names": [
              "--color-text-accent"
            ]
          }
        },
        {
          "id": "accent-color-border-focus",
          "label": "Focus border",
          "kind": "token-swatch",
          "tokens": {
            "category": "color",
            "names": [
              "--color-border-focus"
            ]
          }
        },
        {
          "id": "borders-color-border-subtle",
          "label": "Subtle border",
          "kind": "token-swatch",
          "tokens": {
            "category": "color",
            "names": [
              "--color-border-subtle"
            ]
          }
        },
        {
          "id": "borders-color-border-default",
          "label": "Default border",
          "kind": "token-swatch",
          "tokens": {
            "category": "color",
            "names": [
              "--color-border-default"
            ]
          }
        },
        {
          "id": "article-type",
          "label": "Article type",
          "kind": "token-pair",
          "tokens": {
            "category": "typography",
            "names": [
              "--typo-article-size",
              "--typo-article-line-height"
            ]
          }
        },
        {
          "id": "title-type",
          "label": "Title type",
          "kind": "token-pair",
          "tokens": {
            "category": "typography",
            "names": [
              "--typo-h2-size",
              "--typo-h2-line-height"
            ]
          }
        },
        {
          "id": "section-type",
          "label": "Section type",
          "kind": "token-pair",
          "tokens": {
            "category": "typography",
            "names": [
              "--typo-h3-size",
              "--typo-h3-line-height"
            ]
          }
        },
        {
          "id": "heading-family",
          "label": "Heading family",
          "kind": "token",
          "tokens": {
            "category": "typography",
            "names": [
              "--font-family-heading"
            ]
          }
        },
        {
          "id": "gutter",
          "label": "Gutter",
          "kind": "token",
          "tokens": {
            "category": "spacing",
            "names": [
              "--layout-gutter"
            ]
          }
        },
        {
          "id": "radius",
          "label": "Radius",
          "kind": "token",
          "tokens": {
            "category": "radius",
            "names": [
              "--radius-md"
            ]
          }
        }
      ]
    }
  ]
}
